{
  "$schema": "https://json-schema.org/draft/2020-12/schema",
  "$id": "urn:early-admissions:site-data-manifest:0.1",
  "title": "Early Admissions Site-data build manifest v0.1",
  "type": "object",
  "additionalProperties": false,
  "required": ["artifact", "manifest_version", "site_data_schema_version", "builder_version", "build_timestamp_utc", "build_id", "publication", "input", "sharding", "outputs", "counts", "size_report", "validation", "scope_boundary"],
  "properties": {
    "artifact": {"const": "early_admissions_site_data"},
    "manifest_version": {"const": "1"},
    "site_data_schema_version": {"const": "0.1"},
    "builder_version": {"type": "string"},
    "build_timestamp_utc": {"type": "string"},
    "build_id": {"type": "string", "pattern": "^[0-9a-f]{20}$"},
    "publication": {"type": "object", "required": ["status", "atomic_directory_replacement"]},
    "input": {"type": "object", "required": ["sqlite_path", "sqlite_sha256", "sqlite_size_bytes", "sqlite_build_manifest_path", "sqlite_build_manifest_sha256", "sqlite_schema_version", "sqlite_builder_version", "unified_contract_version", "source_versions", "input_csv_sha256", "gpa_parser_contract_version", "academic_field_mapping_contract_version", "academic_field_taxonomy_version", "academic_field_crosswalk_sha256"]},
    "sharding": {"type": "object", "required": ["algorithm", "search_target_bytes", "detail_target_bytes", "search_shards", "detail_shards"]},
    "outputs": {
      "type": "object", "additionalProperties": false, "required": ["artifacts"],
      "properties": {"artifacts": {"type": "array", "items": {"$ref": "#/$defs/artifact"}}}
    },
    "counts": {"type": "object", "required": ["search_rows", "detail_records", "research_requirement_rows", "research_exact_duplicate_excess_rows", "source_datasets", "universities", "fallback_rows", "gpa_dispositions", "academic_field_mapping_statuses", "academic_field_group_memberships"]},
    "size_report": {"type": "object"},
    "validation": {"type": "object", "required": ["status", "search_equivalence"]},
    "scope_boundary": {"type": "object", "required": ["generated", "not_generated"]}
  },
  "$defs": {
    "artifact": {
      "type": "object", "additionalProperties": false,
      "required": ["kind", "path", "sha256", "size_bytes", "record_count"],
      "properties": {
        "kind": {"enum": ["search_shard", "detail_shard", "filter_options"]},
        "path": {"type": "string"}, "sha256": {"type": "string", "pattern": "^[0-9a-f]{64}$"},
        "size_bytes": {"type": "integer", "minimum": 0}, "record_count": {"type": "integer", "minimum": 0}
      }
    }
  }
}
