{"artifact":"early_admissions_site_data","build_id":"bbffbaee7aadbdb0ae43","build_timestamp_utc":"2026-09-20T08:56:32Z","builder_version":"0.1.0","counts":{"academic_field_group_memberships":{"agriculture_fisheries":423,"arts_design":232,"dentistry":36,"education":787,"engineering":1750,"environment":238,"home_lifestyle":76,"humanities":334,"information":852,"interdisciplinary":46,"life_sciences":631,"medicine":154,"natural_sciences":702,"nursing_health_welfare":778,"pharmacy":173,"social_sciences":608,"sports":45,"tourism_hospitality":16,"veterinary":71},"academic_field_mapping_statuses":{"multi":1833,"review_required":19,"single":4069},"detail_records":5921,"fallback_rows":3,"gpa_dispositions":{"not_searchable":3916,"review_required":806,"safe_numeric":1199},"research_exact_duplicate_excess_rows":4,"research_requirement_rows":437,"search_rows":5921,"source_datasets":{"kokkoritsu":3668,"shidai":2253},"universities":249},"input":{"academic_field_crosswalk_sha256":"8f2c8034395cf7ceebb9675b966d34b638b94cb50569bb90bc426091bac4e762","academic_field_mapping_contract_version":"0.1","academic_field_taxonomy_version":"0.1","gpa_parser_contract_version":"0.1","input_csv_sha256":{"coverage.csv":"b10ca3381afb0f3e8740ed2d14ddf086233151d4c6eba6e946344b12638913fb","master.csv":"1df386ed99532a3dff381507978a1454d7c20113574285b2526f6ae122050279","research_requirements.csv":"ba105cca34c03fee34fb7d04ce1d0818caa386d0832e7999bf9ec9bf9f135919"},"source_versions":{"kokkoritsu":"5.61","shidai":"0.97"},"sqlite_build_manifest_path":"data/derived/sqlite/build_manifest.json","sqlite_build_manifest_sha256":"7a703e44b3ef20f88ed0fcfce54c944be2f50a2edb97165ba569962e664bd88b","sqlite_builder_version":"0.3.0","sqlite_path":"data/derived/sqlite/early_admissions_2027.sqlite","sqlite_schema_version":"0.1","sqlite_sha256":"6a59be8707e30fa07d0f40d1e297c57b3c55d071f834c579d99090bdee3e50a0","sqlite_size_bytes":28086272,"unified_contract_version":"0.1"},"manifest_version":"1","outputs":{"artifacts":[{"kind":"search_shard","path":"assets/bbffbaee7aadbdb0ae43/search/search_rows-000.json","record_count":707,"sha256":"e4e4fb3e1c030183967982cbdea5c1b0c453d4ba237bc3d14b3fd2f7b00f42a7","size_bytes":1059638},{"kind":"search_shard","path":"assets/bbffbaee7aadbdb0ae43/search/search_rows-001.json","record_count":782,"sha256":"fecfed5a50aab060d18e356401809079b30f69c3ecec017bed81d5d6a9ea461b","size_bytes":1173683},{"kind":"search_shard","path":"assets/bbffbaee7aadbdb0ae43/search/search_rows-002.json","record_count":746,"sha256":"2bf0f8ab6402ae6b2d2d103670a947fb84ea086c8307485474836e08916637d7","size_bytes":1115541},{"kind":"search_shard","path":"assets/bbffbaee7aadbdb0ae43/search/search_rows-003.json","record_count":714,"sha256":"de82da2b289a0ab9b3d940e60e484570a24e178f1b019a40dbb5db7455412902","size_bytes":1069070},{"kind":"search_shard","path":"assets/bbffbaee7aadbdb0ae43/search/search_rows-004.json","record_count":746,"sha256":"3fb0284c1665e59a7f01c5fab674e9065c3654f36f751a91e67c07453aac3eec","size_bytes":1120740},{"kind":"search_shard","path":"assets/bbffbaee7aadbdb0ae43/search/search_rows-005.json","record_count":756,"sha256":"e1ed606828999e28436f406758cc0fc87f893da1b549dc045d31ace7575988d4","size_bytes":1131056},{"kind":"search_shard","path":"assets/bbffbaee7aadbdb0ae43/search/search_rows-006.json","record_count":715,"sha256":"8e104a7c351d97f87e5836432c45e1feeedb927848b00a5a276bbe9d0a53662e","size_bytes":1074992},{"kind":"search_shard","path":"assets/bbffbaee7aadbdb0ae43/search/search_rows-007.json","record_count":755,"sha256":"b6dc0d74389e12b41687197c7ba49d104a3c5a26fd25b4b932eeb17cd3c8759a","size_bytes":1131627},{"kind":"detail_shard","path":"assets/bbffbaee7aadbdb0ae43/details/details-000.json","record_count":39,"sha256":"5164cc725f1fbc90a900d14c0023b04983029af95513c8a618883fd7a944fbcc","size_bytes":194343},{"kind":"detail_shard","path":"assets/bbffbaee7aadbdb0ae43/details/details-001.json","record_count":59,"sha256":"5d1224afc9a9890331710049f895d4d5936eb947d80ec18b0567f5c8cebc6662","size_bytes":284907},{"kind":"detail_shard","path":"assets/bbffbaee7aadbdb0ae43/details/details-002.json","record_count":45,"sha256":"1a7e5e38348273bac7fda753275dcaf4b39295f80a89cfb43e4a80cabb67d09c","size_bytes":223866},{"kind":"detail_shard","path":"assets/bbffbaee7aadbdb0ae43/details/details-003.json","record_count":41,"sha256":"246057198285d489734f96d396bc6a74e244ce19bcdfff681e10e481a7e15354","size_bytes":206329},{"kind":"detail_shard","path":"assets/bbffbaee7aadbdb0ae43/details/details-004.json","record_count":53,"sha256":"91255e770d518fc1ac962c04f507422e3d591f3cdb83f3bdf8ce15259cd06494","size_bytes":254592},{"kind":"detail_shard","path":"assets/bbffbaee7aadbdb0ae43/details/details-005.json","record_count":55,"sha256":"3ad999d54c9191e02b05a44b16edd8a4a24c9b6eca9aff219071a0c26e1cd675","size_bytes":266449},{"kind":"detail_shard","path":"assets/bbffbaee7aadbdb0ae43/details/details-006.json","record_count":50,"sha256":"eaaa49be105f7b2ba0a0245aa99f6780bbb85aa3f150c30824448265c5e4c8e4","size_bytes":249678},{"kind":"detail_shard","path":"assets/bbffbaee7aadbdb0ae43/details/details-007.json","record_count":49,"sha256":"77652c60383715ad792360e070786472e00af5822385abfa5294a7ac4547cb00","size_bytes":236658},{"kind":"detail_shard","path":"assets/bbffbaee7aadbdb0ae43/details/details-008.json","record_count":48,"sha256":"9e855e00cc89c9a356c110a93e091afe6131608939a8e420c1f9e8ed01a42ab3","size_bytes":240945},{"kind":"detail_shard","path":"assets/bbffbaee7aadbdb0ae43/details/details-009.json","record_count":46,"sha256":"e89aee0232aba47faa1c76183db245ba49f7ee4be1135aa334743937cd4e755b","size_bytes":223980},{"kind":"detail_shard","path":"assets/bbffbaee7aadbdb0ae43/details/details-010.json","record_count":67,"sha256":"d18a7623f04a63e2d6dea010ba5c70f1a3f8f2cb750dc044f657d65cdfd7cbb4","size_bytes":333488},{"kind":"detail_shard","path":"assets/bbffbaee7aadbdb0ae43/details/details-011.json","record_count":48,"sha256":"b10d2e02853b2d8d9d94cfe771a3b12ff29f1de747d83a047d21d910fbd867ec","size_bytes":236517},{"kind":"detail_shard","path":"assets/bbffbaee7aadbdb0ae43/details/details-012.json","record_count":55,"sha256":"9d415a31169e620a7a469cc06a4e432ac7cbf389376565be3124c4fab102eac3","size_bytes":270218},{"kind":"detail_shard","path":"assets/bbffbaee7aadbdb0ae43/details/details-013.json","record_count":52,"sha256":"87492a3f9b6403f8048e938fe81e4d2b49fff89cd5c30d628e3c5fca62d2e927","size_bytes":250541},{"kind":"detail_shard","path":"assets/bbffbaee7aadbdb0ae43/details/details-014.json","record_count":52,"sha256":"7706c13c5abd8f9d14f03ead935a22c179669e59efc15243052e8d7823c15c69","size_bytes":259223},{"kind":"detail_shard","path":"assets/bbffbaee7aadbdb0ae43/details/details-015.json","record_count":50,"sha256":"b4628429e8c0a45fc4540cc444f2d08a888ec398f115b5a3b03e152337ae1c03","size_bytes":240523},{"kind":"detail_shard","path":"assets/bbffbaee7aadbdb0ae43/details/details-016.json","record_count":37,"sha256":"9b9397323f88f4a4a619e03acd8bdd6be3166647d0211746bfb0a9ddda625a57","size_bytes":184461},{"kind":"detail_shard","path":"assets/bbffbaee7aadbdb0ae43/details/details-017.json","record_count":45,"sha256":"28c6018d84a7090fd1b3c983e14d7e43e0eb5fb7010a1fab98053485dd0f7345","size_bytes":224134},{"kind":"detail_shard","path":"assets/bbffbaee7aadbdb0ae43/details/details-018.json","record_count":45,"sha256":"d18ab39c014dd4815f4186ec3fc742ada215daa92dc36cbbe232a74c33049e24","size_bytes":223315},{"kind":"detail_shard","path":"assets/bbffbaee7aadbdb0ae43/details/details-019.json","record_count":35,"sha256":"9bab5de86d662e054d3d5afbd26e35bb8456a72e5bc2fb57c3a1fd120a641e55","size_bytes":165234},{"kind":"detail_shard","path":"assets/bbffbaee7aadbdb0ae43/details/details-020.json","record_count":56,"sha256":"6a94a29bf1e64696493b239f8080f5ff1f9e02e0829f43bbd4b54f000cf35e30","size_bytes":281823},{"kind":"detail_shard","path":"assets/bbffbaee7aadbdb0ae43/details/details-021.json","record_count":45,"sha256":"9e98708eeb37481a1520f0b58e298cd7536c615e8e483bd6ef9cc61922b16910","size_bytes":215280},{"kind":"detail_shard","path":"assets/bbffbaee7aadbdb0ae43/details/details-022.json","record_count":41,"sha256":"ca4cd2b5b7502686511ce75d743b8f2ef3420b9898248f77777279cba321b570","size_bytes":196496},{"kind":"detail_shard","path":"assets/bbffbaee7aadbdb0ae43/details/details-023.json","record_count":58,"sha256":"76b27d9f8dfc005e33d5f8ec8588a4dd8dc786f3d8613a974f7b6964b2c3a5b2","size_bytes":277005},{"kind":"detail_shard","path":"assets/bbffbaee7aadbdb0ae43/details/details-024.json","record_count":53,"sha256":"3d5d246114aed183466ae370e1c073994af9e669c1ddaffe6b6e74e33a2f5a26","size_bytes":263717},{"kind":"detail_shard","path":"assets/bbffbaee7aadbdb0ae43/details/details-025.json","record_count":52,"sha256":"858a6d4e3df0a3a53c61eb11d3a7950889e790eca95a3099888cb48f9f9782a1","size_bytes":254303},{"kind":"detail_shard","path":"assets/bbffbaee7aadbdb0ae43/details/details-026.json","record_count":50,"sha256":"9d3500ffe92208e87eaf43a111648e6049ed5cff1e5e085b1834314aab5ed895","size_bytes":240630},{"kind":"detail_shard","path":"assets/bbffbaee7aadbdb0ae43/details/details-027.json","record_count":37,"sha256":"a1f95a51ce96ce2522351b67c96bfd4d0ef7d2dfc08efc61902bd679ff58fcef","size_bytes":182639},{"kind":"detail_shard","path":"assets/bbffbaee7aadbdb0ae43/details/details-028.json","record_count":43,"sha256":"2ad609ae6d69d7cdfd258e631b8a04f644a0530104bcacb549ff576bef62ba54","size_bytes":209174},{"kind":"detail_shard","path":"assets/bbffbaee7aadbdb0ae43/details/details-029.json","record_count":45,"sha256":"c2920470384154466f8564b389210b4d7cae59e87383b051f61d56f141afae25","size_bytes":224320},{"kind":"detail_shard","path":"assets/bbffbaee7aadbdb0ae43/details/details-030.json","record_count":49,"sha256":"4c38cf1ff2b8e192379e41a6d091508bfb5bbe220a1b093dff743ae24b2b3172","size_bytes":239184},{"kind":"detail_shard","path":"assets/bbffbaee7aadbdb0ae43/details/details-031.json","record_count":42,"sha256":"192c3737222f0dfb24cc5b290b3df77d5fd5abf027f04cf8cb5197